speechdate,speakeroldname,maintopic,subtopic,speechtext,speakerparty,speakerriding,speakername
2018-04-26,"Ms. Cheryl Hardcastle (Windsor—Tecumseh, NDP)",Oral Questions,Status of Women,"Mr. Speaker, women with mental health or cognitive-related issues are four times more likely to report experiencing sexual violence. The government's response to this shocking reality has been with Bill C-65 and social development programs. This is woefully inadequate, due to the harsh reality.
I would like to hear the government explain to us today why it is not taking this issue seriously and what it is actually going to do now.",New Democratic Party,Windsor—Tecumseh,Cheryl Hardcastle
2018-04-26,"Hon. Patty Hajdu (Minister of Employment, Workforce Development and Labour, Lib.)",Oral Questions,Status of Women,"Mr. Speaker, we share the member's horror at the experience women have every single day in this country with gender-based violence. That is why, as a former minister of status of women, I was so honoured to be part of creating the very first federal gender-based violence strategy, which we have funded to the tune of at least $100 million, with more in budget 2018.
My colleague, the Minister of Status of Women, is currently working with grassroots organizations to ensure the full implementation of the gender-based violence strategy.
Bill C-65 is historic legislation in that it will provide protection for federally regulated workers and—",Liberal,Thunder Bay—Superior North,Patty Hajdu
