speech_date,text,speaker_party,speaker_riding,speaker_name,speaker_gender
2018-01-29,"Mr. Speaker, I want to stand and say how pleased I am to see the strong support of parliamentarians across the political spectrum for this particular bill.
As a physician, I am very familiar with violence of all kinds, including workplace, domestic, and societal violence. Due to the fear, stigma, and shame associated with violence, most people do not talk to anybody but do feel safe talking to their physician. I was always a repository of all of this information and knowledge, sometimes unable to do very much about it except to advise a patient about what to do.
Today, we see full disclosure. Everyone is disclosing now, and because of that full disclosure, some people feel very safe in joining the ranks and the throng so they are not singled out. However, it does not mean the shame has gone away. It does not mean that the stigma has gone away. It does not mean that blaming the victim has gone away.
It is not enough to talk about the issue. We have to do something concrete, and who, other than this place, this Parliament, can do something concrete about this? We make laws and we create policies, and we create programs that will deal with the issue once and for all.
I believe this bill is creating—albeit some people think it should be amended, etc.—a first step to keep a promise the Liberal government made when it first came to power, that it would deal with exactly this particular workplace harassment and this particular culture in the workplace. 
We need to look at this. I know people have spoken about different types of harassment and violence. I want to say that violence is not just physical and it is not only sexual. Psychological violence is rampant in the workplace, where people do things or do not do things or do not say things because of the fear of losing their job or a promotion or of reprisals by the people who are in authority in the workplace.
We need to really look at a full and comprehensive spectrum of violence. Psychological violence is as important and as damaging as actual physical violence. There is a great deal of psychological violence in the workplace.
To look at this, we need to look at an integrated approach. I think we are looking at—",Liberal,Vancouver Centre,Hedy Fry,Woman
2018-01-29,"Mr. Speaker, having sat with my colleague on the Standing Committee on the Status of Women from 2006 to 2011, I must say that she is very knowledgeable about sexual harassment. She has long been a strong supporter of victims. I know that she will raise some good points about this bill, and I hope that, for once, they will be non-partisan.",Conservative,Beauport—Côte-de-Beaupré—Île dOrléans—Charlevoix,Sylvie Boucher,Woman
2018-01-29,"Mr. Speaker, I am sharing my time with the hon. member for West Vancouver—Sunshine Coast—Sea to Sky Country. 
If I may be permitted, I will just quickly go over the first bit of what I said. I am really pleased to see the support of all members of Parliament for this bill, despite political affiliations. 
This is an issue that is of great interest to me, as a physician. The fact is that people fear reprisal, there is stigma, and there is shame with regard to violence of any kind. I am familiar with physical violence, domestic violence, and societal violence. Sometimes the only person victims feel safe to tell their stories to is their physician, because of patient-physician confidentiality. Quite often physicians cannot do very much about it because people cannot be forced to speak out or to go wherever they need to go, but we can do certain things. 
We now have a culture where there is open disclosure. People are less afraid to speak out because of the number of people who are speaking out. There is safety in numbers, and people feel they are not being singled out. They feel it is safer to speak out. However, that is not enough. There is still stigma and shame attached to victims of violence. The mentality to blame the victim still goes on. 
We need to take concrete steps to change workplace culture, and Bill C-65 would do that. If we pass the bill in the House and we bring in the policies and the program that would support the bill, we would see a slow but definite change in the culture of at least the House of Commons as well as federally regulated workplaces.
There are three areas we need to look at. As always, protection is the most important. As a physician, I can treat diseases. I can put on bandaids and do whatever I need to do. However, if I do not look at the cause then I am not able to give long-term help or long-term support.
We need to look at the culture. This culture of abuse of authority and of making people afraid in order to do what one wants them to do is not 150 years old. This has gone on for millennia. This culture is so deeply ingrained that it is going to be difficult to remove it, but with goodwill, we can all start to do it.
The first thing we need to do is examine ourselves. What do we do? How do we think? How do we behave? What are the thoughtless things we do to our own staff when we are angry at them or we feel they are not doing the job well? What are the things that we do, both men and women, whether physically, psychologically, or in fact sexually, that make our colleagues feel ashamed and threatened? These are the things we need to do first. 
Before we can do anything, we need to take the physician health thyself approach. We have to look at our behaviour. We have to look at how we pass information on to our children. We have to look at how we bring up our children so they can learn to respect each other and understand the way to behave with each other. We have to start with these fundamental things. It begins in kindergarten.
I have heard people talking about pornography, etc. That culture starts at the beginning of one's life. That culture starts with how we deal with each other from the very beginning, with how we talk with each other at home around the dinner table, with how we shame people and how we denigrate people. These are some of the things that we have to start examining.
We need this legislation. This legislation looks at how we can protect people from workplace violence. Employers would be required to investigate, record, and report incidents. That is the first thing. Labour programs would bring in toll-free lines for employees and employers to link up with experts who can help them through conflict resolution and negotiations, as well as navigate all of the processes.
We need to look at providing educational material, which this legislation would provide. We need guidelines that would provide support services for those who are victims, keeping foremost in mind the safety of the complainant. Complainant safety is really a problem. Fear of reprisal is a big problem, as is losing one's job, being demoted, not getting the wanted promotion, or not getting that big part in a movie one wanted.
Some of these are very real, and people need to feel that they are not going to be blackballed for the rest of their lives because they spoke out. That is going to be very important as we look at the protection component.
The next one is to look at effectiveness and if we have effective ways of dealing with this: how to deal with it effectively immediately; how to deal with a problem when it occurs; and how to support the victims themselves? That is a big part of that effective response.
Even though I stand here as I woman and as a long-time feminist, I want to say that this is not only about gender harassment. Indeed, there are men who are harassed in the workplace, either psychologically or physically. In fact, men are more at risk of physical violence in the workplace. When we look at that, we see 19% of women have a tendency to seek help, fill out a report, and look for support services; yet only 7% of men do that because of the absolute shame that a man has of being in this position. Therefore, I want us to look at the broad ways in which we can deal with this problem for both genders, to look at all of the ways in which we can keep people down. If because of this bill a lot of men are going to seek help, then it will help them to get the help they need.
The third pillar is to support the employees who are affected. This legislation does not replace the Criminal Code. There are going to be times when we need to look at going to enforcement because of the criminality of an act that has occurred in the workplace. This does not replace that, but it will bring into force Part III of PESRA, which is the employer and staff relations act that would bring in health and safety precautions and protections into the workplace.
I caution everyone in this House not to think that we will turn on a dime and that we will make changes. However, by passing this legislation right now, and by the ability of all of us in this place to think that this is extremely important enough to come together and to forget our differences, then we will make it safer for people to feel they can speak out, by protecting them when they speak out. If we do that, it will be one major step in moving this agenda forward. However, we need to have clear guidelines and clear policies. This bill is going to do exactly that, so we are not just talking or just tut-tutting and saying how terrible things are; we are actually putting into place concrete processes, steps, and sanctions that will affect employers and employees in the workplace.",Liberal,Vancouver Centre,Hedy Fry,Woman
2018-01-29,"Mr. Speaker, I listened carefully to my colleague's passionate speech. She highlighted a number of important details about the bill, but I would like to go back to the definitions, which are just as important.
There can be such a thing as too many definitions when the time comes to go to court or make legal decisions. An overabundance of definitions can be restrictive. The flip side is a legal vacuum, and definitions can vary from one country to another. When it comes to defining harassment, a person can say they have been physically harassed or even assaulted, and there is also the definition of psychological harassment. It varies from person to person. 
I would like to know what my colleague thinks about the importance of including definitions in Bill C-65. Does she think the government will agree to the amendments about definitions that the NDP is going to propose in committee?",New Democratic Party,Jonquière,Karine Trudel,Woman
2018-01-29,"Mr. Speaker, the hon. member makes a very important point. If we do not know what we are talking about, how can we deal with it properly? Then we get vague. The member is absolutely right that no one can do anything if there is vagueness and the barriers that are created by vague language. I hope that, when the committee looks at this, it will look at ways in which to strengthen the bill and make sure it works for everyone. The political will is here. All of us in this House, in every political party, are in agreement that we want to do something and we want to make it stick. We want something that is effective. Therefore, I am hoping that we will all be able to talk about this in the spirit that we have right now in this House, one of co-operation, and build not only a very strong and good bill but a set of regulations that will make this work well.",Liberal,Vancouver Centre,Hedy Fry,Woman
2018-01-29,"Mr. Speaker, the member raises an important point, and I am very well aware of what the status of women committee said. It is very difficult, though, to police what people do in the privacy of their own homes. I think the member is talking about underage people. There is not just legislation and police who can deal with underage children. There is parenting. There is the V-chip that can be installed to prevent kids from getting certain things on television and stop people from accessing certain things if they are underage. Parents need to take responsibility for doing this in their homes. 
I know of so many young women and men who are locked in their bedrooms and are on their computers doing who knows what, and they are victims of luring and predators. We need to talk about how to deal with this. I do not know that we can legislate what people do in the privacy of their own homes, but we might want to talk about policies and programs that might give parents the tools they need to prevent their children having access to certain things that are harmful to their growing minds.",Liberal,Vancouver Centre,Hedy Fry,Woman
2018-01-29,"Madam Speaker, it is an honour to speak in the House today in support of Bill C-65, especially because parliamentarians and the House of Commons are finding common cause in taking action on workplace harassment and violence. 
Clearly this affects us all. We all know someone who has experienced some form of harassment or sexual violence in the workplace, and some of us may even have experienced it ourselves.
 We know of the debilitating impact harassment and sexual violence has on women, on under-represented groups, employers, and Canadians in general. This is a key commitment of our government, and I am very proud that Bill C-65 is our effort to address harassment and sexual violence in federally regulated workplaces. This bill works to create safer and more respectful workplaces and sends a clear message to all Canadians that our government, the Government of Canada, is saying that harassment and sexual violence is unacceptable. 
A lot of research shows us that this workplace behaviour has gone on for far too long and has also gone largely unreported. An Abacus Data survey last fall asked Canadians about harassment in the workplace. It found that over one in 10 Canadians said that sexual harassment was really quite common their workplace. Another 44% said that it was infrequent but it did happen. These respondents reported that women aged 30 to 44 were most likely to see this problem in the workplace. One-fifth said that it was common, and a total of two-thirds said that it happened in their workplace.
 The study results explain that “The prevalence of this behaviour is no doubt in part because it rarely carries consequences for the harasser...The large majority of women, and most men, agree that normally there are no sanctions applied against those who sexually harass women in the workplace.” These findings paint a staggering portrait consistent with the picture that was painted during our recent government consultations.
 Our government makes policy and legislative changes based on evidence through meaningful consultation with Canadians. Over the past year, the government has consulted widely with stakeholders and Canadians to gain a deeper understanding of the issue and to determine the best way to move forward. Consultations were also held with the government House leader, members of Parliament, and the Senate. I think it is very safe to say that all members and senators support the work we are doing together on this front. 
In November of last year, we released the report “Harassment and Sexual Violence in the Workplace Public Consultations: What We Heard”, which summarized our consultations. I would encourage my hon colleagues to read it, share it with their constituents, help educate everyone about the intolerable impact this has, and join together in taking action. 
Allowing this type of behaviour to continue in our workplace negatively impacts not just individuals, not just groups but ultimately the entire country as a whole and the country's economy. For example, we know that harassment and sexual violence primarily affects women. This means that women and other vulnerable groups face barriers to fully participate in the workforce and in society. How can they not when they feel threatened at the place they work? These behaviours act as barriers to not only women but other vulnerable and under-represented groups, such as members of the LGBTQ2 community. These are the very groups of people we need to ensure have a fair chance at success. We need diversity of viewpoints in businesses, organizations, the public service, and, of course, right here. 
We know that our culture is largely patriarchal. It is a culture where the sexualization of women can contribute to intolerance. Somehow this is seen as normal. Research shows us that visible minorities, people with disabilities, and members of the LGBTQ2 community are also disproportionately affected. We found that this behaviour was tied to power and privilege, and that it was independent of gender. It is often those with the least power who are least able to advocate for themselves. They fear reprisal, including sanctions or shame, and are least likely to be aware of what they can do to stop inappropriate behaviour. This creates and perpetuates inequality. 
Sexual harassment can be more persistent in low-wage, low-profile jobs where there is, most unfortunately, low accountability for the employer. It means that the less power and status one has, the more likely one is to be vulnerable to experiencing harassment or sexual violence at work.
The fact is that no one should feel scared or like a target in places of work or anywhere else for that matter. This is especially true for women and under-represented groups, and their families suffer as a result. Harassment and sexual violence are also critical barriers women face when entering the workforce and maintaining employment that is lucrative enough to provide for themselves and their families, which makes sexual violence and harassment not just a moral issue but of course an economic issue as well. Victims of harassment and sexual violence often feel that once reported to their employers, any steps taken by employers to address the behaviour are often insufficient or ineffective. One aspect of this bill would ensure that employers are required to investigate, record, and report occurrences of harassment and violence. Employers would also be required to take steps to prevent and protect against these behaviours as well as respond to them when they do occur and provide support to employees affected by them.
Employers are not immune to paying a price and feeling a negative impact as well. This impact is felt through reputational costs, loss of productivity or absenteeism, low levels of employee commitment, high turnover, or legal costs. This adds up in lost time, stress, depression, and anxiety. It costs employers financially and it certainly does not build a strong, cohesive, and resilient Canadian society.
Allow me to note that we are also strengthening compliance and enforcement mechanisms under the code. The use of monetary penalties and the authority to publicly name violators are just some of the changes announced to increase workplace health and safety and protect workers' rights. 
Our government ran on a commitment to take action on workplace harassment and sexual violence in Parliament and in federally regulated workplaces. Today, together, we take an important step toward that aim. I am confident we will be joined by our colleagues and Canadians and that others will follow our lead. This is about doing what is right for people and doing what is right economically. 
My hon. colleagues and I know the status quo is not an option. We know we need this legislation and that we should support it for families, employers, and all Canadians.",Liberal,West Vancouver—Sunshine Coast—Sea to Sky Country,Pam Goldsmith-Jones,Woman
2018-01-29,"Madam Speaker, I would like to congratulate my colleague on her speech. I would like her to tell us how Bill C-65 will apply to organizations with collective agreements. 
For example, how will Bill C-65 and the collective agreement apply in resolving a harassment complaint that has gone to arbitration and where there is proof of harassment?",New Democratic Party,Jonquière,Karine Trudel,Woman
2018-01-29,"Madam Speaker, maybe this is a little unusual, but I would also like to thank my colleague for her contribution to this. I am not able to get into details, but no doubt this is the beginning of a lot of serious work. Each and every one of us is taking harassment and sexual violence in the workplace very seriously. Of course, it is going to take beyond the members of Parliament in the room, and I look forward to ongoing consultation with Canadians to ensure the success of Bill C-65.",Liberal,West Vancouver—Sunshine Coast—Sea to Sky Country,Pam Goldsmith-Jones,Woman
2018-01-29,"Madam Speaker, I thank my hon. colleague for his work and for offering that suggestion. This is what will happen next, I would say. 
We are taking the lid off something that has gone on for so long, that has gone unreported and has created such suffering, and intergenerational suffering. The good work that is being done around the world will only help make Canada a stronger, more resilient, and safer society.",Liberal,West Vancouver—Sunshine Coast—Sea to Sky Country,Pam Goldsmith-Jones,Woman
2018-01-29,"Madam Speaker, I think it speaks to the fact that this is commonly understood by parliamentarians to be a serious challenge in Canadian society. It goes to show that while we are always trying to improve our institutions and to be more open, transparent, and inclusive, certain things cut straight to the heart of the matter. We are all very privileged and honoured to be discussing Bill C-65 and what we can do with regard to workplace harassment and sexual violence.",Liberal,West Vancouver—Sunshine Coast—Sea to Sky Country,Pam Goldsmith-Jones,Woman
2018-01-29,"Madam Speaker, if we are looking at the incidences of sexual harassment and we take it here to the House of Commons as an example in attracting more women to politics and encouraging more women to stay in politics, how important is it that women, men, and people of minorities across the country hear that all people in the House are working together to find a solution regarding the issue of sexual harassment in the workplace?",Liberal,New Brunswick Southwest,Karen Ludwig,Woman
