speech_date,text,speaker_party,speaker_riding,speaker_name,speaker_gender
2018-05-07,"Madam Speaker, I will be sharing my time with the member for Rivière-des-Mille-Îles.
I am extremely proud to speak today about Bill C-65, which is important legislation to address harassment and violence in federally regulated and parliamentary workplaces. Through this bill, our government is taking an important step toward building a country where Canadians are better protected from inappropriate behaviours, including sexual harassment and sexual violence, and where those who have experienced such abuse receive the support they need.
I was proud to sit on the Standing Committee on Human Resources, Skills and Social Development and the Status of Persons with Disabilities for the duration of its study of Bill C-65 and was privileged to have the opportunity to propose amendments to this bill. 
Legislation alone will not solve the problem of harassment and violence.
We know that a cultural shift is also needed.
Sadly, we live in a society that has tolerated workplace harassment and violence, that accepts power imbalances and gender norms and creates and reinforces these behaviours. 
However, it is our view that Bill C-65 will go a long way in supporting a much-needed and long-overdue cultural shift. With this legislation, the government is sending a clear message that harassment and violence in the workplace, including parliamentary workplaces, is entirely unacceptable. The negative impact of these toxic behaviours on the individuals who experience them, as well as on their families and co-workers, is enormous.
During a visit to Edmonton earlier this year, I met with members of the Union of Safety and Justice Employees who worked in the extremely toxic environment that had developed at the Edmonton maximum security prison. I hope they are watching today as the bill moves through the House, knowing the information that they shared with me helped to frame my work on committee as we studied the bill.
Over the course of the committee hearings, we heard from many witnesses who described situations and incidents that no one should have to endure. We heard from Beisan Zubi, a former Parliament Hill staffer, who described some of the sexual harassment she witnessed and in some cases was subjected to herself during her time on the Hill. These experiences included touching, groping, comments and come-ons, and older men telling stories to a table of young staffers about their sexual encounters with young staffers. Ms. Zubi recounted how at one point her body was being discussed by others right in front of her. 
As a young Parliament Hill staffer many years ago, I too experienced and witnessed this type of behaviour, which was tolerated and accepted then and continues to be tolerated in some circles today.
The unfortunate reality is that many people who are harassed have felt as though they had no choice but to leave. They felt fundamentally unsafe and unsupported, or they stayed because they had no other option for financial reasons or out of fear for their colleagues whom they would leave behind. I was told by one staff member at Edmonton Max that she could not leave the good ones behind to suffer the abuse on their own.
One of the issues that has come up over and over again, especially on Parliament Hill, has to do with defining harassment and violence. Since the #MeToo movement and the important discussion that followed, I have noticed that there is a lot of confusion about what is and is not appropriate behaviour.
That is why the committee introduced a definition of harassment into Bill C-65. It will help employees and supervisors understand how to conduct themselves in a respectful and appropriate manner in the workplace and learn what behaviours might be unwelcome or inadvertently harmful.
Many have stayed silent because they knew their complaints would not be treated seriously and that bringing a complaint forward might even result in negative repercussions from their employer. In many cases, supervisors themselves are the perpetrators. That is why we made an amendment to the bill at committee stage to allow employees to come forward to someone other than their direct supervisor, which would give them more options to report.
Many Canadians continue to work every day knowing they will be subjected to inappropriate behaviour from their co-workers or supervisors. This mentality is still deeply ingrained in our culture. These experiences are all too common and take place in all types of workplaces. Many women nod in recognition when I ask how many of them have taken a different route to get to their desk in the morning to avoid that one person.
There needs to be an understanding that this behaviour cannot and will not be tolerated and that this is a country where no one should have to endure harassment or violence of any kind.
To this end, we are putting into place a comprehensive approach that takes the full spectrum of harassment and violence in the workplace into consideration, and we are expanding coverage to parliamentary workplaces for the first time. This approach focuses on preventing these behaviours before they happen; responding effectively when they do occur; and supporting victims, survivors, and employees throughout the process.
Once the new process is put in place, we expect to see a better understanding of what workplace harassment and violence is and what behaviours are unacceptable, as well as more willingness among employees to speak up about this behaviour understanding that they have a right to be safe. Ultimately, we expect to see a culture change in the workplace where there is zero tolerance for harassment and violence.
 We know that legislation can never be the only fix for the pervasiveness of harassment and violence in the workplace in Canada. Culture change requires work and it will take all of us, not just within government, to see that change through. Legislation is one tool our society has in its tool box and I am proud to have been part of this process to strengthen our laws around violence and harassment so that survivors have more support.
In order to drive a culture change in workplaces, we know that we need to play a more active role in raising awareness and educating workplace parties around the issue of harassment and violence in the workplace. We will work closely with employers and employees and other key stakeholders through the regulatory process to provide an opportunity for them to influence the design of the specific requirements of employers and employees.
We will also undertake extensive education and outreach to ensure that employees understand their rights and employers understand their roles and responsibilities. The good news is that a culture change is under way. The global movement against workplace harassment and violence on social media has brought a great deal of attention to the issue and has shed much-needed light on it. I am immensely impressed by the bravery of those who have shared their stories.
More and more people are having these conversations, not just in the media and in politics, but in workplaces around the world. They are more than just conversations, but transformational change in our understanding of healthy workplaces. 
All members of the House agree on the importance of the bill and are committed to working together to get this important piece of legislation right. Throughout our committee hearings and during debate on the bill, there has been an unprecedented level of all-party co-operation, something that speaks to the importance of this legislation.
 I am proud to speak to the bill today as I strongly believe it is a very important step forward in our efforts to improve our workplaces, one that would help create healthy, respectful environments where employees feel safe and are not afraid of reprisal, and where businesses increase their productivity and prevent losing talent and experience.
 I would like to thank the departmental officials for their hard work in helping to put the bill together and also assisting us during the committee as we navigated the complex aspects of the bill. It was an honour to sit in with members of the committee as we studied the legislation. I extend a special thanks to the witnesses who shared their stories, their advice, and wisdom with the committee to inform our discussions. Finally, I would like to express my sincere appreciation to all members of the House for their support in getting the bill to the next step in the parliamentary process.",Liberal,Oakville North—Burlington,Pam Damoff,Woman
2018-05-07,"Madam Speaker, we in this place are quite united in our desire to ensure that workplace harassment, sexual harassment, these kinds of activities are no long tolerated or accepted in any part of our society, although the bill only goes to the issues surrounding work within government and particularly here in Parliament. 
I also worked here many years ago when I was in the office of the minister of the environment in the 1980s and can attest to knowing exactly how much young women had to put up with. No young woman or young man should ever have to put up with the kind of cavalier attitude that boys will be boys and that we should let these things go by and not stand our ground. 
I agree with the member that this is a sea change. We are seeing a transformational change that is global, in re-examining those things that were considered to be a patriarchal right to speak to women in different ways than they would speak to a male employee without giving it a second thought. Are there other places where the member thinks this Parliament could do more? The bill is a good step, but it is not going to be enough to make a society-wide transformation.",Green Party,Saanich—Gulf Islands,Elizabeth May,Woman
2018-05-07,"Madam Speaker, I thank the hon. member for her work on this issue. She is absolutely right. Legislation can only go so far. We had a lot of conversations at committee about the regulations that will accompany the bill. 
When it comes to political parties, we need a process within each party for staffers to come forward. That is not something that will be legislated within this bill, but we certainly need the opportunity for all staffers to feel safe to come forward. 
In my opinion, it needs to be someone completely independent. It cannot be done within the parties. I feel that staff need to be able to come forward to someone who is independent to share their concerns. Once that has been done, the legislation can kick in, in terms of what the framework is. It is important for those processes to continue as we move forward.",Liberal,Oakville North—Burlington,Pam Damoff,Woman
2018-05-07,"Madam Speaker, I listened carefully to my hon. colleague's speech.
Under this bill, the legislation must be reviewed every five years. That is important, because our values and customs need to improve. I would like to hear my colleague's thoughts on the idea of enshrining this in law. I wonder if she could talk about the benefits of this five-year review and the reports that must be submitted annually.",Liberal,Rivière-des-Mille-Îles,Linda Lapointe,Woman
2018-05-07,"Madam Speaker, the member is absolutely correct. It was something I brought up during the committee study when I asked witnesses whether the legislation should be reviewed.
 It is important that we make sure legislation is working properly, and having that review in place will allow us to look back and determine which parts of the legislation were working and which parts were not. Quite honestly, if we find out within two years that a part is not working and we need to change it, we have that ability, but this will require every government in the future to make sure it is looking at the legislation to see how it can be approved.",Liberal,Oakville North—Burlington,Pam Damoff,Woman
2018-05-07,"Madam Speaker, during discussion of this legislation at the committee stage, an amendment was brought forward by the Conservative members regarding timelines. 
When a victim comes forward with a complaint and it is made official, as it stands right now there is no timeline in place with regard to how much time the investigation should take. It could take one year, two years, five years, or 10 years. This seems to re-victimize the victim because it lacks due process. 
I wonder if the member would like to comment on why the party opposite turned down this amendment and feels that it is in the best interest of victims to prolong these investigations.",Conservative,Lethbridge,Rachael Harder,Woman
2018-05-07,"Madam Speaker, we listened to the testimony that we heard at committee and we asked officials about the best way to frame the legislation. We framed the legislation based on the testimony we heard at committee.",Liberal,Oakville North—Burlington,Pam Damoff,Woman
2018-05-07,"Madam Speaker, I am really happy to be here today to speak to this very important bill.
With Bill C-65, our government is taking an important step towards building a country where all Canadians are better protected from workplace harassment and violence, including sexual harassment and sexual violence, and where victims of such abuse receive the support they need. I am certain that all members of the House will agree that we must ensure that no one is prevented from fully participating in society as a result of bullying, harassment, hate, or violence.
As a government, it is critical that all of us understand these phenomena, so that we can determine how to stop them. Over the past two years, we have consulted a number of stakeholders, our partners, and all Canadians to understand how the problem of harassment and violence is currently being handled in federally regulated workplaces. It became essential that we look at how to strengthen our anti-harassment and anti-violence measures. 
Two types of consultation took place: a public consultation through an online survey, and a series of round tables and teleconferences with stakeholders. Following those consultations, we prepared a report on our findings from the engagement activities we had held with the Canadian public, unions, employers, non-governmental organizations, academics, and other experts. The report was published in November, and I invite all members of the House and all Canadians to read it, if they have not already.
I want to spend a few minutes on our key findings. First, we noted that levels of harassment and violence remain high, even here in Canada. Although the survey was not representative, since all respondents self-selected, the results were nonetheless alarming. Harassment was the most common type of behaviour experienced by online survey respondents, 60% of whom reported having experienced it, while 30% said that they had experienced sexual harassment, 21% that they had experienced violence, and 3% that they had experienced sexual violence. Among respondents who had experienced sexual harassment, 94% were women.
The second finding from the consultations has to do with prevention measures. Although there are policies to prevent workplace harassment and violence, work must be done to raise employer and employee awareness of these issues. Awareness is part of prevention. If employers are more aware of the problem, they will be able to understand what is happening in their workplace and respond appropriately. We need to face facts. All too often, incidents are not reported, and when they are, the response is ineffective.
The third finding has to do with the measures taken in response to such incidents. Although 75% of online survey respondents who had experienced harassment or violence reported the most recent incident, 41% of them said that no attempt was made to resolve the issue. Of those respondents who did not report the most recent incident, many feared reprisals if they filed a complaint. Nevertheless, employers must ensure that their workplaces are free from harassment and violence. Despite everything, it is not always mandatory for employers to provide support mechanisms for victims.
The fourth finding of the consultations was that little support is currently available for victims of harassment and violence. Most respondents believed that employers, the government, and unions should be responsible for providing support to help victims feel safe and secure in their workplace. What is more, stakeholders told us that clear written policies are needed so that organizations know how to respond to allegations of workplace harassment and violence. It is therefore important to educate employers so that they can provide effective support for people who report acts of violence or harassment.
The last finding of the consultations has to do with under-reporting and insufficient data.
As I said earlier, people in these situations are afraid to file a complaint because they fear reprisals. Stakeholders agreed that appropriate data should be collected to track results. In the end, we concluded that the existing measures are just not good enough. There is no comprehensive system in place to prevent and address harassment and violence. Instead, we have a patchwork of federal laws and policies on these issues.
For example, violence is covered in part II of the Canada Labour Code, which applies to all federally regulated workplaces, including the public service. However, harassment is dealt with in part III of the Canada Labour Code, which does not apply to public servants, only to federally regulated private-sector employees. Moreover, neither part covers parliamentary workplaces. 
During our consultations, experts told us that we should treat occurrences of harassment and violence as a continuum of inappropriate behaviours, extending from teasing, which is not always funny, to physical violence. We need a comprehensive approach. We need to be clear about the sources of those behaviours and the consequences.
Essentially, we need a cultural shift. Grey areas are no longer good enough. We need to embrace the idea that Canada has zero tolerance for all forms of workplace harassment and violence. I am pleased to say that this bill reflects the consultations and will meet many of those needs. I am very proud of the work we have done on Bill C-65. This new legislation will initiate a cultural shift in federally regulated workplaces thanks to a new framework that will better protect employees from harassment and violence. It will go a long way toward de-normalizing harassment and violence by preventing and reducing these problems. 
In closing, as I said, the results of the consultations are clear: the measures in place do not go far enough. We must make it our goal to bring about a profound cultural shift that leads us to civility and respect and puts human rights above all differences.
Let us not forget that violence is born out of inequality and that inequality is born out of discrimination against women and others who are victims of it. It is therefore of the utmost importance that acts of harassment and violence are addressed at every level so that these injustices do not go unpunished. That is the purpose of Bill C-65.",Liberal,Rivière-des-Mille-Îles,Linda Lapointe,Woman
2018-05-07,"Madam Speaker, I thank my colleague from Rivière-des-Mille-Îles for her speech and for being one of many seeking change.
Under the Liberals' bill, employers need an internal policy to drive deep cultural change. That is what employers, women's groups, and union representatives wanted from the committee. They asked for clear guidelines in the Canada Labour Code so employers would know what constitutes an appropriate code of conduct.
A number of groups even proposed a code of ethics, but the Liberals rejected the idea for reasons known only to themselves. A code of ethics could have been added to the Canada Labour Code to help employers define their internal policies with the help of guidelines on immediate assistance, handling complaints, confidentiality, and protection of private information. 
Why is none of that available to employers, who do not really know what to do in terms of prevention and enforcing a framework that applies to anything that might happen in a workplace? That is something all the parties wanted, but the Liberals refused.",New Democratic Party,Salaberry—Suroît,Anne Minh-Thu Quach,Woman
2018-05-07,"Madam Speaker, I thank my hon. colleague for her question.
There are three very important elements of the regulatory framework that will be mandatory for employers, namely preventing harassment and violence, responding when incidents involving harassment or violence do occur, and supporting the victims of harassment and violence.
Many other things are also included in those three elements. Regarding the first one, preventing harassment and violence, employers must ensure that employees receive training and they must work with employees to put a prevention policy in place. Everyone needs to participate, employees and employers alike. As for the second element, responding to incidents involving harassment or violence, employers must respond within a specific timeframe to address the complaint and inform the complainant of the appropriate privacy safeguards in place.
There are therefore plenty of things in place to ensure that employers' obligations are taken into account.",Liberal,Rivière-des-Mille-Îles,Linda Lapointe,Woman
2018-05-07,"Madam Speaker, I thank my colleague from Rivière-des-Mille-Îles for her moving speech.
 As a member of the status of women committee myself, I heard many witnesses, including women from indigenous, immigrant, and LGBTQ2 communities, talking about several topics we have studied. We heard from many victims who did not have the courage to report their aggressor. As a female parliamentarian, I myself have been bullied—I am not talking about sexual harassment—and I reported the people who tried to bully me.
As a fellow female parliamentarian, can my colleague explain how a few years from now, after Bill C-65 passes, the new climate on the Hill might encourage more women to get into politics? Will this bill increase women's participation?
 How does she see—",Liberal,Vimy,Eva Nassif,Woman
2018-05-07,"Madam Speaker, there is no doubt that the more women we have on Parliament Hill, the more the culture will change. It is a deeply entrenched culture that we have to change.
Bill C-65 will help change the culture. There are three important things, as I was saying earlier. The regulatory framework seeks to prevent incidents, intervene effectively to support the victims and survivors, and help employers.",Liberal,Rivière-des-Mille-Îles,Linda Lapointe,Woman
